video_id,title,view_count,duration,upload_date,transcript
RdSrHw9LAlU,These cats don’t like cooling bed #cat #shorts,1475786,54,20250820,"These cats do not like their cooling beds. Look, the weather is too hot. The cats are all overheating. So, the owner bought them a cooling mat. But once the cats stepped on it, they started acting super weird. Their paws twitched. They could barely walk. Turns out the mat was pulling on their fur, so none of them dared to step on it. Some even jumped over it. The owner had no choice. He bought another mat with smaller gaps. He thought it would work better, but it pulled even more fur. One cat thought lying down would fix it, but it felt worse. It got so mad it tried to scratch the mat apart. The owner still did not give up. He bought one with even finer gaps. But after trying it, the cats just wanted to bite it to pieces. Later, the owner brought home a cooling stone mat, but the cats would not step on it at all. The owner was losing hope. Finally, he bought a cold metal basin. Surprisingly, the cats loved it. They rolled around and slept inside. This gray cat even claimed the basin and would not let the others near"
NNiilEvWg8A,This cat love the big egg,1607808,56,20250820,"This cat thinks it laid an ostrich egg. Look, when the cat was using the litter box, the owner secretly placed a duck egg behind it, tricking the cat into believing it was hers. At first, the cat did not believe it until the owner used a toy duck to act out the egg laying process. The cat was shocked and thought it really laid an egg, so it took on the role of a mother, guarding the egg all the time. Even the owner could not take it away. But one day, when the cat was in the litter box again, the egg was accidentally crushed by the owner's girlfriend. There was no choice. The owner boiled the egg and gave it to the cat to eat. At first, the cat enjoyed every bite until it realized the egg it was eating was the one it had been guarding. In that moment, the cat was heartbroken. It stayed sad all the time. Not even its birthday could cheer it up. So, the owner decided to surprise it with a giant ostrich egg. The moment the cat saw the egg, it lit up with joy. It could not wait to sit on it and start hatching. But then the next"
WbImTrcBCdA,This smart cat learn tricks to take care of itself,3250557,57,20250819,"This owner teaches cat how to take care of itself, but things end up wrong. Look, since he had to leave for 3 days, he decided to teach his cat some survival skills. First, he showed it how to turn on the faucet to drink water. The cat learned instantly, but the next second, the whole kitchen was flooded because the cat had no idea how to turn it off. Next, worried the cat might be scared of the dark, he taught it how to turn on the lights again. The cat picked it up right away, but then it kept switching the lights on and off, thinking it was a game. The owner was speechless to make sure it had enough food. He put out 3 days worth of meals. But the cat ate everything in one go. So, the owner had no choice. He bought an automatic feeder. It could release food on schedule and even let him watch the cat while it ate. But just when he was about to leave, the cat climbed straight into his suitcase, wanting to go with him, he couldn't take it along. And when he finally came back, the cat greeted him with excitement. But the moment the fever made a sound, it ditched him right away and ran off to eat instead."
4T1StgNHMqw,This adorable cat toilet training end up wrong,10096032,58,20250819,"This owner tried to teach his kitten to use the toilet, but things went wrong. Look, this little kitten is only 2 months old and it still can't use the toilet. It keeps peeing on the couch, sometimes even pooping under the bed. The owner was going crazy. To keep the house clean, he decided to train the kitten to use the toilet. First, he dug a hole in the litter box. Then, he placed some paper inside. Then, he showed the kitten how to cover it. But halfway through the lesson, the kitten just fell asleep, so the owner had no choice. He asked the big cat in the house to teach it instead. The big cat showed it step by step. At first, it looked like the kitten understood, but when it tried to cover things, it just scratched at the air. It even almost ate its own poop. By the end of the lesson, the kitten just lay down and slept in the litter box. The owner was completely defeated. He bought lots of tasty food and begged the big cats to keep teaching the kitten. After a month of training, the kitten finally learned to use the toilet."
LA3GpZ9tVWg,This cat smell another cat,949596,57,20250818,"This is why you should never pet a stray cat. Look, this girl only touched a stray cat once, but when she got home, her own cat started acting really crazy. It kept sniffing the hand that touched the other cat with a shocked look on its face. Then, it started meowing loudly, almost like accusing her of cheating for touching another cat. At first, the owner thought it was funny. She didn't realize how serious it was until the next day. She noticed her cat was really sad. It looked like it was about to cry. When she called it, the cat completely ignored her. It even stopped eating and drinking, hiding in a dark corner with tears in its eyes, afraid that its owner would abandon it. This broke the owner's heart. So, she quickly showed the cat a video to explain she only touched a poor stray. Then, she kept petting her cat to show love and comfort. In the end, she even bought a bunch of tasty food and the cat's favorite plush toy to say sorry with her care and affection. The cat finally cheered up again and forgave her. Now it is back to being a happy little kitty."
if_g_KmCBw0,The owner bought lights for his dog but things went wrong,274892,42,20250817,"If you have dogs, never buy these lights. Look. One night, this guy got up. The room was too dark. He tripped over his dogs and fell hard to avoid this happening again. He installed a light strip under his bed. He thought problem solved. But at night, his dogs looked terrifying. The man thought maybe it was the color of the lights, so he changed it, but that only made them look scarier, like creatures crawling out of hell. The man knew this was not going to work, so he ordered a sound activated light online, but he got the wrong size. He bought an oversized one. He still did not realize how bad this was until that night. One of his dogs made a noise. Now the man does not have to worry about lights anymore because he is almost blind."
nqRYVhRNmtI,This cat was tricked by its owner twice,4086355,58,20250817,"This cat got tricked by its owner twice. Look, when the owner took the cat shopping, the cat wanted a golden collar, but the owner said it was too expensive. She said she could not afford it. The cat got so mad it kept meowing, forcing the owner to buy it or it would not go home. So, the owner had no choice. She bought the golden collar. But once they got home, the owner worried the cat might lose it. So, she took it away, saying she needed to clean it. Then gave the cat a fake one instead. But when the cat walked past the bathroom, the collar got stuck to a magnet. That is when it realized it was fake. The cat felt so heartbroken. It stopped paying attention to the owner. To cheer it up, the owner took it shopping again. This time, the cat wanted an expensive Laboo doll. It refused to leave without one. The owner was speechless. She told the cat she would order it online. But when the package arrived, the cat hated it because the dolls looked nothing like the ones in the store. Clearly, they were fake. So, in the end, the owner had to put on a giant labu costume just to win the cat's forgiveness."
zV46vXXaPPk,These cats want to try human food but,2307290,52,20250816,"These cats really want to try human food. Look, every time the owner gets ready to eat, he finds the cats drooling on the side. One of them even tries to sneak a bite to stop them from stealing food. The owner comes up with an idea. He sticks toothpicks all over the plate, so the cats cannot touch it, but soon he realizes he cannot eat properly either, so he buys a big metal cage and locks himself inside to eat. The cats watch him hungrily from outside. He even teases them with food on purpose, seeing them want it so badly, but not getting it. The owner thinks it is hilarious, but soon he regrets it because the cats climb onto the shelf and their drool falls right into the dishes. The owner is devastated. A whole meal ruined to break the cat's bad habit. He later brings home some really stinky food. When the cats smell it, they almost throw up. They think the owner is eating poop, so when he sits down to eat, one cat tries to save him and knocks the food over."
2eOl6behFDI,This cat loves watch its owner take shower,1548613,55,20250816,"This cat loves spying on handsome guys in the shower. Look, whenever the owner takes a shower, the cat rushes to the bathroom and climbs on a stool to watch. At first, the owner thought the cat was trying to protect him because the cat always believed that showering was dangerous. So, he thought the cat was just worried. But lately, he noticed something strange. The cat often pushes him to take a shower. And every time he walks into the bathroom, the cat shows up at the door with a weird expression on its face. This made the owner suspicious, so he pretended to shower with his clothes on. Surprisingly, the cat lost interest right away. Turns out, the cat just wanted to see him without clothes. The owner was speechless, but he couldn't stop the cat from peeking. Until recently, he noticed the cat seemed to lose interest in him. Whenever he tried to pet it, the cat resisted. But when a handsome stranger visited, the cat suddenly became very friendly. That's when the owner realized the cat was ignoring him because he had gained"
56XzBYD4QWM,This chubby cat doesn’t want to lose weight,3004743,53,20250815,"This cat does not want to lose weight. Look, when the owner was feeding the cats, he noticed the gray cat's back had split open. He got scared. He quickly checked and luckily it was just some stuffing. But then he realized this gray cat was way too chubby for the sake of its health. He decided to put it on a diet. Step one, slow down its eating. He spread the treats evenly on a mat so the cat would not gulp them down too fast. But the gray cat found it too much trouble and simply refused to eat. So, the owner bought a slow feeder bowl, hoping to make it eat slower. But halfway through, the cat got tired and walked away. Next, he brought home a treadmill, thinking it could get more exercise. The other cats ran happily, but when it was this gray cat's turn, it just stood there without moving. Later, the owner taught it to do sit-ups. To his surprise, the cat actually started working out, but it still did not lose weight."
7fdNclJ0Aek,These cats don’t miss the owner,5455910,59,20250815,"These cats really miss their owner. Look, he had to leave for a trip, but he can't take the cats with him. So, he filled up a giant tub of food, enough for a whole month when the kitten stood on it. It looked like standing on top of a mountain, but he was still worried. So, he lined up a whole row of bowls, all filled with cat food. Then, he bought a huge litter box and filled it with fresh litter. When the kitten walked in, it looked like walking through a desert. Afraid the cats would get thirsty, he set out several big bowls of water. He even gave each cat its own cozy little bed playing their favorite cartoons. But when it was time to leave, he found all the cats hiding in his suitcase like they wanted to go with him, but he had to leave them at home. Whenever he missed them, he checked the cameras and saw the cats waiting by the window, hoping he would come back soon. This really touched him. But when he finally got home, he realized they didn't actually miss him because the litter box was full. They just wanted him to scoop their poop. In the end, he accepted his fate and scooped out 12 full bags, plus one big"
9IVsNhx6XUw,This cat don't like the fake cat,1395563,56,20250814,"This owner pranked his cats with a fake cat. Look, at first he pretended to feed them treats just to see how they would react, but every single cat fell for it. They really thought he was holding snacks and all of them started eating air. One cat even kept begging for more. This made the owner wonder, maybe his cats are just a bit dumb. So, he printed out some fake cat food to see if they could tell the difference. Nope. They happily kept munching on air, not noticing anything was wrong. Now, the owner was sure his cats were total dummy. Then he printed a photo of a strange cat just to mess with them. Sure enough, as soon as they saw it, they thought it was real and immediately got into attack mode. When the owner brought the photo closer, one cat ran straight into another room and even knocked over the trash can. The owner couldn't help but laugh. Then he got an idea because this cat loves sneaking into his bed at night and attacking his weak spots. So he covered the side of the bed with fake cat photos and the catar to get on the bed"
m42Ler8w_gM,The owner pretended to dislike his own cat,772204,54,20250814,"This is why you should never ignore your cat. Look, this owner pretended to be disgusted by his cat and the cat licked a slice of pizza. He cut that piece right in front of it and threw it straight into the trash. The cat was shocked, so it licked the owner's drink to test him, but the owner cut off the straw it licked and tossed the whole drink into the trash. Now, the cat was sure the owner really hated it, especially when it saw him cuddling another cat in bed. Jealous, it jumped up to get his attention, but he completely ignored it. The cat was heartbroken. It sat alone in the corner almost crying. When the owner saw this, he felt guilty. He quickly told the cat it was just a prank and went in for a kiss. But after learning the truth, the cat refused to let him kiss it because now it decided to hate him back. When the owner finished cooking, it sniffed the food and acted like it was about to throw up. It even stopped him from petting it. And when he fell asleep to get revenge, lay on his face and let out a huge"
mujCMNc_rzA,This owner making products to collects his cats fur,9430376,58,20250813,"Watch how this owner collects cat fur. Look, this guy loves making products out of cat fur, like cat fur socks, cat fur boots, and cat fur gloves. He even makes a bunch of cute stuffed toys with it. But when he wanted to make himself a hat, he realized he was short on fur. So, he tried to borrow some from his cats, but they were afraid of going bald. So, none of them agreed. Then, he came up with a plan. He bought a comb, pretended to groom his cats, but was really just collecting loose fur. Later, he thought the comb was too slow, so he got a fur vacuum. And in no time, he had a whole box of fur. But once the cats saw it, they figured out what he was up to and refused to let him touch them. So he built a special box to collect cat fur. When the cats crawled inside, the brushes would pull the fur off. But when it is this gray cat's turn, he realized the cat was too chubby to fit in. So he built a bigger box, and it worked. In the end, he made himself a cat fur hat and even made one for each of his cats. And since he had so much leftover fur, he turned it into one giant fur"
W5ZAN9h9oAQ,The owner’s prank made the cat and its friend fight,814001,59,20250813,"This owner stole the cat's favorite snack. Look, every time this cat got a treat, it would only eat half, then hide the other half under the rug. Whenever the owner went near that rug, the cat would guard it, stopping the owner from finding the stash. Until one day, while the cat was sleeping, the owner quietly took the snack from under the rug and put it in the ferret's food bowl. When the cat woke up, it was shocked to see the snack was gone and it couldn't find it anywhere. Then the owner told it the ferret stole it. So the cat went straight to the ferret and angrily smacked it in the face. The ferret was speechless and decided to get revenge. Every time the cat hit a snack, the ferret would steal it right after. This drove the cat crazy. Got so mad it smacked the ferret once more. In the end, the ferret decided to make peace. It gave the cat a cookie and finally earned its forgiveness. But when the cat went back to its room, it hidden cookie was gone. Turns out the cookie the ferret gave it was the same one it stole from under the rug. Now the cat swears it will never forgive the fairy"
9qSEgORIxaU,The owner bought a fish tank house for her cat,376826,54,20250812,"This cat has a giant fish tank house. Look, this cat loves watching fish. It often sits by the fish tank staring for the whole day. So, the owner bought a fish tank bed as a birthday gift for the cat. First, the owner spread a layer of sand inside, then added some pretty decorations. After filling it with water, she put the little fish inside. Just like that, a beautiful fish tank bed was ready. The cat was so happy. It loved the gift and went inside every day, watching the fish up close. But the owner noticed the house was a bit too small and the cat had trouble getting in and out, so she ordered a bigger one. She let the cat try it first. It fit perfectly. Then she started building the new fish tank. Now the cat stays in there everyday and never wants to come out. Seeing how much the cat loved it, the owner got an even bigger tank, so the cat could watch the fish from every angle. Once the new fish tank bed was done, the cat completely fell in love with it."
IvFhcod0yF0,The owner made weird products for his cats,5471494,58,20250812,"This owner makes all kinds of weird products for his cats. Look. After he finished eating a mango, he noticed the mango peel was the same size as his cat's paw. So, he had an idea. He made a bunch of mango shoes for his cats. When the cats put them on, they looked super cute. Seeing how much the cats liked them, he even made a pair for himself. But he forgot about the smallest cat in the house. That made the little one really upset. So, the owner bought a durian, planning to make durian shoes for it. But as soon as the cat smelled the durian, it almost grew up. The owner cut out the durian skin to make insoles, then used the cat's fur to make shoelaces. Just like that, a cute pair of cat durian shoes was ready. But when the kitten wore them, it faded them. It thought the shoes smelled awful and refused to forgive the owner. So the owner made it a pineapple hat instead. In the end, the owner went all out and used every vegetable in the house to make shoes. But halfway through, he ate all the vegetables. The cats were speechless. They thought the owner had gone crazy and decided to find a new"
HhxMrx78zVY,The owner has a genius way to stop her black cats from hiding #shorts,2055404,57,20250811,"Why you should never get a black cat. Look, ever since she got two black cats, she could never find them because they loved hiding in the dark. Sometimes she would suddenly find one in the trash can, sometimes in a cooking pot. They would even hide on a black blanket, blending in perfectly. She was afraid she might step or sit on them by accident, so she decided to let them feel the same way. She painted herself black and hid in the cat bed. When the cats came close, she suddenly popped out, scaring them so bad she disguised herself as a giant plush toy. When the cats relaxed, she jumped out again. The cats leapt straight into the air, but soon they started to enjoy the game. When the owner hid in the cabinet, the cats found her right away. Then they hid on a blanket nearby. And when the owner came out, she didn't notice them at all. She was speechless, so she bought a black cat plush toy, planning to teach them a lesson. She placed the plush on a black blanket, then pretended to step on it by accident. The real cats freaked out. After that, they never dared to hide in the dark"
Q9aUZj0-WJE,These cats love the tiny bed #cat #funny #shorts,1446814,57,20250811,"This owner gave each cat a tiny bed. Look. At first, these cats all slept inside the space pods. But one day, the owner got curious and took one of the pods away. When a cat tried to sleep, it almost fell straight down. That scared it so much it never dared to sleep there again. So, they all moved to the owner's bed instead. At first, the owner thought it would be fun to sleep with them. But when he fell asleep, all the cats piled on top of him. He could barely breathe, so he had to sleep on the floor. To fix the problem, the owner bought some mini beds and set them up beside his bed. The cats loved them. But at night, when the owner fell asleep, he kept snoring. The noise made it impossible for the cats to rest, and he even let out a silent fart. One cat smelled it and almost threw up. None of them slept well that night, and they all woke up with dark circles. The owner felt so bad, he immediately bought medicine to stop his snoring. But that night, the cats picked up his habit and started snoring, too. Now the owner is the one who can't sleep at"
qEZoye9QTWg,The owner's prank made the cat sad,13492876,51,20250810,"This owner tricked his cat into thinking its ferret friend had died. Look, when the ferret was sleeping, the owner noticed it would not wake up no matter how he called it. Then he got a sudden idea. He told the cat the ferret had passed away. At first, the cat did not believe it. It even tried to wake the ferret by hitting it. But the owner put the ferret in the trash bin. Seeing the ferret lying still. The cat could not believe it. It really thought its best friend was gone. It became so sad it refused to eat all day. It even cried so much it soaked the bed sheet. But that night, the ferret woke up drinking water like nothing happened. The cat saw it. At first, it did not notice anything strange. Then it looked again and thought it was a ghost. It ran away in fear. Realizing it had been fooled, the cat smacked the ferret and even gave the owner a slap. The ferret had no choice but to carry a little cookie as an apology. In the end, they made up and became best friends"
azYaE7mAIhY,These cats love the water bed,16835815,51,20250810,"This is why you should never buy a water bed for your cats. Look, since the weather was too hot, the owner bought a water bed to help his cats cool down. At first, the cats did not like it at all. They jumped away the moment they touched it. But soon, their fear was gone, and they happily played on the water bed. Then, while the owner was sleeping, a cat accidentally bit the bed and broke it. When the owner woke up, he slipped and almost fell back asleep on the floor. That is when he realized the whole house was flooded. to teach the cats a lesson. He decided to let them taste what it felt like to be soaked. So, he bought a giant water bed and let the cats swim in it. At first, they were scared of the water. They jumped up the second they touched it. But soon, they started swimming happily because it felt so cool. From then on, the cats kept asking to swim everyday."
eAPjla0kN-Y,Why you should never let your cat catch a spider,2929169,46,20250809,"This is why you should never let a cat catch a spider. Look. When this owner found a spider, he trapped it under a cup. Planning to show it to his cat, but the cat looked confused because there was nothing inside the cup. Then he realized the spider was actually on his shirt. The man freaked out, but when he looked in the mirror, the spider had disappeared again. He got even more terrified, so he asked the cat to catch it. The kitten searched the whole room, but found no sign of the spider. Then the owner noticed the spider was hiding on the kitten. The poor cat panicked and ran out of the room, hiding under a chair. When the other cats heard there was a spider in the house, they all disappeared, too. One hid inside a drawer, another hid behind the toilet. Two more even squeezed into the closet. Now, the owner totally regrets it because he can't find any of his cats anymore."
A0ZX-yV_f7s,These cats don’t like the giant plush,2819518,55,20250809,"This guy bought a giant stuffed toy for his cats. Look, because his cats love all kinds of plushies, he used their photos to make custom toys for each one. But the toys turned out super ugly, and the cats hated them. He still had not made one for the little kitten in the house. So, he picked a cute photo of it and turned it into a toy. But the result was nowhere near as cute as the picture, and the kitten was not impressed at all. So, the owner chose an even cuter photo and ordered a giant plush version. When the cats saw it, they were all terrified. But once they realized it could not move, they instantly lost interest. Then the owner got an idea. He pulled out all the stuffing from the giant toy and secretly climbed inside. When the cats came close, he suddenly started moving and scared them half to death. Every time the cats relaxed, he would walk out in the plush suit again and send them running. The cats got really mad and decided to get revenge. When the owner was sleeping, one cat quietly climbed onto his face and let out a"
