video_id,title,view_count,duration,upload_date,transcript
nzd-xtjBlOk,This cat is not the father of the kittens,13488728,57,20250808,"This gray cat got cheated on three times. Look, when the female cat got pregnant, he thought the babies were his, so he took care of her every single day. But when the kittens were born, their fur looked nothing like his. To find out the truth, the owner did a paternity test. Turns out, not a single kitten was his. The gray cat was heartbroken. To cheer him up, the owner found him a new girlfriend. Soon, this golden cat got pregnant, too. This time, the gray cat was so excited he even started reading parenting books. He just wanted to be a good dad. But when the kittens came out, they were all white. Clearly not his kids. He was devastated. He often hid in the corner and cried. So the owner found him another girlfriend. This time it was a black cat. She gave birth to a new litter of kittens and their fur color finally matched. The gray cat took care of them like a real dad. But secretly, the owner did another paternity test, and once again, none of the kittens were his. The owner decided to keep it a secret just so the gray cat could stay"
kOHevEhYh-E,This cat was fooled into taking a bath,692927,55,20250808,"This owner has a genius way to trick his cat into taking a bath. Look, every time he tries to bathe the cat, the cat refuses completely. It even climbs to high places and scratches him badly. So, the clever owner came up with a plan. He borrowed the neighbor's pretty dog and let the dog go charm the cat. The cat had no idea. It walked right into the trap. Soon, the cat totally fell for the cute dog. That's when the owner started phase two. He gave the dog a nice bath on purpose and made sure the dog looked super relaxed. After the bath, the dog acted all snobby, refused to play with the dirty cat. The cat got confused, so it asked the owner why. The owner told it, ""You're too dirty."" Then the cat actually asked for a bath. This time, it behaved perfectly just to win the dog's attention again. But while the cat was being dried, the owner and the dog celebrated their success, then sent the dog back home. That's when the cat realized it had been tricked. It was so mad it gave the owner a slap in the [Music]"
Jxc1BnqeA9k,These cats don’t like birthday gifts,1498308,53,20250807,"These cats don't like their birthday gifts. Look, when it was their birthday, their owner got them a bunch of presents. The first gift was a pillow with their ugliest photos printed on it. The cats were speechless. They refused to believe they looked that bad. The second gift was a pair of shoes made from mango peels. They looked cute wearing them, but they hated it because in their eyes, it was just trash. The third gift was kisses from their owner. The cats were even more done. One of them even turned around and gave the owner its butt, but the owner still kissed it without hesitation. The fourth gift was a handmade stuffed toy. The owner plucked some fur from each cat, then used felting techniques to turn the fur into mini versions of them. Now each cat has its own little twin. They liked the toys, but they were also worried they'd go bald. The last gift was a set of fancy snacks. This time all the cats were finally happy because in their minds this was the best birthday gift"
P_Q4q9xN7tU,This cat make its owner get rich,789000,57,20250807,"This cat found her owner's boyfriend's secret cash. Look, while the girl was hanging out with her friend at home, the cat accidentally popped a balloon. It startled both of them, but then they saw there was a dollar bill inside the balloon. The girl immediately realized this might be her boyfriend's hidden cash, so she popped every balloon in the room. Sure enough, each one had money inside. She asked the cat to keep looking. Surprisingly, the cat kept staring at the ceiling. The girl felt something was off. She reached up and found tens of thousands of dollars hidden up there. Next, the cat went to a suspicious looking trash can. Inside were dozens of gold covered bills. Then the cat spotted a loose thread under the carpet. The girl pulled it and out came a huge bundle of cash. There was so much money she kept pulling all the way out the door. Down 12 floors and just when she thought it was over, the cat found a mysterious box in the cabinet. She opened it. Inside was half a million dollars. Now the girl is super rich."
0O7K6WeI6SU,This cat failed the IQ test,5078517,58,20250806,"This owner realized his cat might be a dummy. Look, after he finished cooking, he accidentally left one cat locked in the kitchen. The cat started panicking, scratching the door non-stop trying to get out. But the owner was speechless because the door on the right was open. The cat could have just walked out from there. Even after the owner pointed it out, the cat still ignored it and waited by the closed door like it didn't see anything. That's when the owner started thinking, ""Maybe this cat isn't very smart, so he decided to do an IQ test."" He placed some snacks on a glass table to see how the cat would try to get them, the cat just scratched at the glass like crazy. Trying to grab the snacks through it, the owner was shocked, but still not fully convinced. So, he tried another test. If you hold a cat near a wall, a smart cat will put out its paws. A dumb one won't. When you tested the other cats, they all used their paws. But when it was this cat's turn, it didn't even move a paw. Now, the owner was sure this cat is definitely a dummy. The funny part, when he tested the cat's daughter, she failed,"
KbTBB6qXMuY,how to make your cats get more clingy,8604633,58,20250806,"This guy just wanted his cats to be more clingy. Look, because he's obsessed with cats. So, every time he cuddles his cats, he acts super dramatic, which totally weirds the cats out. Plus, he's always eating super smelly food, so the cats avoid him even more. Eventually, they all started ignoring him completely. To fix this, he came up with a plan. He bought a bunch of catnip and soaked his feet in it. Surprisingly, the smell attracted all the cats. They instantly became super clingy. He was so excited by the result, he took it to the next level and gave himself a full-on catnip bath. Sure enough, right after the bath, the cats wouldn't leave him alone. No matter what he was doing, they kept sticking to him. He was over the moon. But very quickly, he started to regret it because when he went to bed, all the cats piled on top of him. They kept licking him non-stop. One even sat on his face. His nose was full of cat hair. And to his shock, he realized all that licking was making him go bald. Now he totally regrets it and just wants a little space from his clingy cats."
-aSlwyAASJM,This black cat help its owner found her boyfriend’s hidden fortune,4170533,58,20250805,"This is why you should get a black cat. Look. When the girl woke up, she saw her black cat destroying her puzzle. At first, she was super mad, but when she looked closer, she found over $10,000 hidden under the puzzle. She instantly realized it was her boyfriend's secret stash, so she asked the cat to keep looking. Surprisingly, the cat led her to a suspicious cabinet. Then, she noticed two of the shelves looked a bit shorter than the rest. She opened one and found a bunch of expensive drinks inside. Then she opened the other and found $100,000 hidden there. Next, the cat found a bag of cat food. The girl thought the cat was just hungry, so she gave it a little snack, but then she found another 10 grand inside the bag. She was speechless, but it didn't stop there. The black cat brought her to the bathroom and started meowing at the toilet. She didn't believe anything would be in there until she lifted the tank lid and found a stack of property deeds. Turns out her boyfriend was secretly rich and she never would have known if it weren't for her money sniffing Black Cat."
EkYwdSDaNHQ,This cat love pretty woman,2834473,56,20250804,"This cat is obsessed with pretty girls, but totally hates men. Look, whenever it sees a beautiful woman, it gets super affectionate. It licks her legs, crawls into her arms for cuddles, and even splashes water on her clothes just to make her go take a shower. Then, it hides in the corner, peeking while she bathes with a weird little smile on its face. Sometimes, it even gets a nose bleed. But when it sees a man, it instantly gets annoyed because of the cat's weird behavior. The owner's friends stopped coming over, so to fix it, the owner dressed her boyfriend up like a pretty girl just to prank the cat. At first, the cat was totally fooled by his appearance and even gave him a kiss. When the boyfriend kissed back, the cat looked shy. Then, it wouldn't leave him alone. Just when it felt all happy and in love, the boyfriend suddenly ripped off his wig. The cat was shocked. It finally realized this was actually a man, it ran away in horror. That night to get revenge, the cat climbed onto the boyfriend's head and let out a huge"
__ecClTvAyQ,The owner bought mini products for his cats,4854568,57,20250804,"This owner bought a bunch of mini products for his cats. Look, the weather was so hot. His cats were panting non-stop, so he decided to buy an air conditioner to help them cool off, but he got the size wrong and ended up with a tiny mini AC. When the cats saw it, they were totally confused. But surprisingly, the little AC actually blew cold air. The owner thought it was super cute, and that was the beginning of the madness. He started buying more mini stuff like a mini cat tower, a mini treadmill, a mini litter box. Even the grooming brush was super tiny. The cats were not amused until he brought out many bowls and tiny food and asked them to eat from it. The cats were done. They decided their owner had lost it and started ignoring him. The owner realized he might have gone too far to make it up. He bought each cat a pair of cute little slippers, but again, he messed up the size. One cat got slippers that looked like boats. The cat was speechless. They all agreed. Their owner had totally lost his mind."
HCvAUQEQn7A,The owner’s prank made the cat afraid of the dark,4206456,57,20250803,"This owner regretted pranking her cat. Look. She sat next to her cat, pretending to pet it, then quietly got up and walked away. But there was still a hand behind the couch, still petting the cat. At first, the cat didn't notice anything, but after a while, something felt off. It let out a confused meow, turned around, and saw a hand with no person. The cat freaked out and ran away in fear. From that day on, it became scared of the dark. Every time the lights go off, it runs out of the room. It even struggles to fall asleep. For the sake of the cat's health, the owner installed a light strip by the bed. But at night, the lights made the cats look super creepy. She thought maybe it was the color, so she changed it to red. Turns out it made them look even scarier. Left with no choice, the owner started watching horror movies with the cat to help it build some courage, but unexpectedly, the cat became obsessed with horror films. Now it always begs to be dressed like scary characters. Then it goes out and randomly scares people on the"
AHi86y5tVVE,The owner's prank makes the cat become the best dad,4028403,57,20250802,"This cat thinks he's the baby's dad. Look, when the owner got pregnant, she photoshopped the cat's face into an ultrasound and told the cat the baby was his. Surprisingly, the cat actually believed it. After the baby was born, he stayed by the baby's side everyday, just like a real father. Even when he was eating, he would run over the moment the baby cried. He also plays with the baby everyday. Even when he's tired, he never gives up. When the baby takes a bath, he sits nearby and watches closely, afraid the baby might drown. When the baby sleeps, he checks the diaper and reminds the owner to change it. When the baby is hungry, he even finds the formula and lets the owner know it's feeding time. What's amazing is that the baby relies on this cat, too. When he cries, all it takes is one look at the cat, and he stops crying right away. The cat truly cares about him. Once when the baby got sick, he had to stay in a separate room. So, the cat brought over all his toys, hoping to comfort him and help him get better soon. So, do you think this cat is a good"
c13L_BaqcfQ,These cats love the giant cold bed,6364837,55,20250802,"This owner bought a giant cold house for his cats. Look, it was way too hot and the AC at home broke. The cat was panting like crazy, sticking out its tongue like a little dog. It even left sweat marks on the bed. To cool down, all the cats started sleeping in metal pots. They left cat hair everywhere. The owner was speechless, so he bought a mini cooling pod, hoping it would help. To his surprise, the cats loved it. They even lined up to use it. Seeing this, he bought a giant cold house so every cat could enjoy the cool air. At first, they just peeked through the door until one cat walked in and realized it was super cold inside. Soon, all the cats went in and got cozy watching cartoons. The owner got curious. He tried it himself, and it was actually amazing, so he kicked all the cats out and took over the whole cold house. The cats were furious. They started ignoring him to make it up to them. He bought a bunch of stainless steel bowls. Now, every cat has its own cool metal"
I1bE1SQVUYk,This cat really cares about its crazy egg,3018927,55,20250801,"This owner made two fake eggs using cat fur. Look, because of an accident, this cat lost something very important. Since then, it's been super sensitive to anything round. Especially when the owner eats eggs, the cat just looks really sad, like it's missing something precious. To cheer it up, the owner used its fur to make two little baby eggs, then added the cat's scent to make it believe they were real. As soon as the fake eggs were attached, the cat lit up with joy. It started licking them non-stop like they were the most precious things ever. It even walked around with its tail up high, showing them off proudly. But the celebration didn't last long. Another cat in the house came over and bit one of the fake eggs off. The cat was shocked, then completely furious. It started fighting the other cat, blaming it for ruining its treasure. After that, it began hiding the fake eggs under the couch. And now, whenever the other cat gets close, it instantly goes into attack mode, afraid someone might steal its baby eggs"
