video_id,title,view_count,duration,upload_date,transcript
fPgC7US8sRo,Why this cat gets angry and keep attacking its owner,423345,58,20250905,"This aggressive cat keeps attacking its owner. Look, when the cat was sleeping, it found out the owner was secretly looking at other cats. Then, when it checked her phone, there were tons of cat videos inside. This made the cat furious. So, every time the owner came close, the cat would launch an attack. The owner tried doing magic tricks, begging for forgiveness, but the cat was not impressed at all. Then, she bought the cat a bunch of new clothes, but every outfit looked terrible. That only made the cat even angrier. It decided to ignore the owner completely. So when the owner tried to brush its teeth, the cat attacked again. Even when she tried to pet it, the cat protested loudly. The owner was desperate. She bought a harmless toy. Pew pew, ready to start a war with the cat. Unexpectedly, the cat accepted the fight and became even more aggressive. In the end, the owner bought piles of snacks and gave the cat ice cream every day. Slowly, the cat finally forgave her. But then one day, the cat exploded with anger again because the owner took the photo and made it look like this."
AW2ZF8W4tPY,These cats don’t like the weird cat products,182720,59,20250904,"This owner bought a bunch of weird stuff for his cats. Look, when he gave his cat a bath, he tried to use a brush to collect the loose fur, but the wrong size and came back with a giant brush. The cat got so scared. After a few strokes, it tried to sneak away like it was afraid of going bald. After that, the owner bought a bunch of toys for the cats, but none of them were interested. The first toy was a fake piece of poop. It could move around, and it even smelled bad. The cats wanted nothing to do with it. The second toy was an automatic teaser wand, but it's fun way too fast. The cats would not even touch it. Next was an automatic jump rope machine, but the cats had no idea how to play. The rope just kept smacking their paws. One cat got mad, grabbed the machine, and tossed it away. Then there was a duck that was supposed to lay eggs, but it was broken and no eggs ever came out. The cats just looked so done. They thought their owner was being childish until he brought home some toy fish. Right away, all the cats gathered around. They stare at the fish all day. [Music]"
3FV517uy3Rs,The owner became the cat’s mom in giant cat custom,233047,55,20250904,"This owner dressed up in a giant cat costume, pretending to be the cat's mom. Look, when she took her gray cat to the vet, she accidentally brought home a white cat instead. She quickly returned it and finally found her own cat in another carrier, but after that, the cat was really upset. Back home, it ignored her completely. It even peed everywhere and dragged its butt on the floor just to protest. So, the owner came up with an idea. She put on a giant cats suit and pretended to be the cat's mom. But the moment the cat saw her, it was terrified. It had no idea what kind of cat this was until she pulled out a brush and started grooming it. Then she gave it lots of treats. After that, she even pretended to carry it like a mama cat. She even bought a fake tongue and licked the cat with it. Soon the cat was convinced. It believed she was really its mom. It started clinging to her just like a kitten to its mother. But soon the owner broke down because the cat kept bumping her chest trying to nurse."
aNgiT0zsizw,orange cat behavior #funny,163863,55,20250903,"Cuz you never mess with an orange cat. Look, when the orange cat was pooping, the gray cat kept bothering it. The orange cat got really mad and started planning revenge. The next day, when the gray cat tried to sleep, the orange cat launched a sneak attack from below. The gray cat had no choice but to move to another spot, but the orange cat jumped up high and attacked again. The owner was speechless to comfort the gray cat. The owner secretly gave it some treats, but the orange cat rushed over, stole the treats, and left the gray cat with nothing. Later, when the gray cat was on the treadmill, the orange cat pounced on it, kicked it off, and took the machine for itself. Even worse, when the gray cat wanted to use the bathroom, the orange cat blocked the door and would not let it in. The gray cat was completely stressed, so now whenever it sees the orange cat, it stays on high alert. Finally, the owner could not stand it anymore and stepped in to make peace. After that, the two cats became friends"
0DAdTnpFi-w,These cats love the strange beds for,1423916,56,20250903,"This owner bought many strange beds for her cats. Look, when she got three cute cat beds, she found two cats had already snuggled in comfortably. But when it was the third cat's turn, its chubby body got stuck in the doorway. The cat felt so sad. To comfort it, the owner specially bought it a Mona Lisa bed. When the chubby cat slept in it, it looked absolutely adorable. However, this made the other cats jealous. They all wanted to try the weird bed, too. No choice, the owner had to buy each cat a painting bed. But soon the cats got tired of these beds and all wanted to sleep in the trash can instead. This left the owner speechless, so she bought a huge cartoon crocodile bed. Surprisingly, the cats loved it. They started lining up to sleep inside, even squeezing in together. So, the owner decided to get an extra-lar bed big enough for three cats easily. But who would have thought? When the owner tried it herself, she found it super comfortable. So she immediately kicked the cats out and claimed the bed for herself."
mnkuNl7KVKk,These hairless cats love take a bath,4702968,46,20250902,"This is why you should never get a hairless cat. Look, this guy got two of them. At first, he thought no cat hair would be a blessing, but he never expected. These cats actually get oily. Everywhere they sit, gets covered in grease on the couch, on the cushions, on the bed, even along the walls, wherever they rub, turns dark and messy. So, the owner has no choice. He has to bathe them every 3 days, and each time he scrubs off a lot of dirt from their skin. Surprisingly, these cats actually enjoy bath time. They just sit quietly in the tub looking so relaxed. After the bath, all they need is a towel to dry off. Now, the owner has completely fallen in love with them because they are super clingy, always wanting to stick close to him. They even learn to fix things for him. So, do you want to raise a hairless cat?"
B_FqZqYSh2M,This cat turned into a water lover,1940319,51,20250901,"This cat is terrified of water, but its owner found a genius way to make it love swimming. Look, every time the owner tried to give the cat a bath, it kept struggling non-stop and ran away in fear. This gave the owner a real headache, so she had no choice but to hold the cat while bathing, but that left her completely soaked. To fix this problem, she decided to teach the cat how to swim. Overcome its fear of water. But the first time it tried, the moment it touched the water, it jumped right out. Then the owner came up with an idea. Since this cat loves pretty girls and often sneaks looks at dance videos, she invited a beautiful girl to be the cat's swimming coach. Surprisingly, with the girl's encouragement, the cat learned to swim right away and even became a pro swimmer. The owner was speechless, but when the girl left, the cat tried again on its own. This time, it pushed too hard and ended up pooping in the pool."
fMY7tTmqve8,This kitten makes a mess with everything,1050355,59,20250901,"This owner thinks her kitten is a total dummy. Look, whenever the kitten drinks milk, it dives head first into the bowl, making a complete mess. The owner is confused because none of the other kittens act like this, so she decides to ring it off milk and teach it to eat kibble. But the next second, the kitten actually poops in the food bowl. The owner is speechless. She tries again, but the kitten thinks the bowl itself is food and starts chewing on it. Then when the owner tries to teach it to use the litter box, the kitten mistakes the litter for food and starts eating it. Not only that, its sleeping positions are super weird. Sometimes its head dangles in the air. Sometimes it props its head up with its paws, so every time it wakes up, its neck is stiff. The owner tries to show it the right way to sleep, but the kitten only learns halfway. Its body is flat on the bed, but its head is still leaning against the wall. The owner is losing her mind. She thinks this kitten must be dumb, but she never knew the reason until she sees the mother cat roughly tossing the kitten onto the ground."
Y8N_kqNilPE,This cat did something wrong,501852,52,20250831,"This girl and her cat started a cold war. Look, when she was trimming the cat nails, the cat scratched her. That made the girl really upset, so she decided to ignore it. When it was feeding time, she didn't kiss the cat like usual. She just dropped the food and walked away. The cat was confused. Later that night, when the girl was getting ready for bed, the cat waited quietly by her side. Normally, she would brush its fur gently and wipe its face with a little towel, but today she did nothing. The cat didn't understand. It climbed onto the bed to sleep with her. If the girl kept pushing it off, she wouldn't let it stay. The cat felt sad and had to sleep on its own mat. The next day, the cat seemed to realize it was wrong. It stuck to the girl and kept acting cute, like it was trying to say sorry. When she saw its sweet face, the girl forgave it, but only on one condition. The cat had to take a bath it really hated. as punishment. Would you want a cat like this,"
PYBiJGw5lKA,This cat wants to go on vacation with its owner but end up wrong,1046718,56,20250830,"This cat wanted to go on vacation with its owner. Look, when the owner was packing for a trip, the cat climbed into the suitcase, meowing non-stop as if asking to come along. But the owner was heading to the snowy mountains. Too cold for a cat, so she prepared plenty of food and set up an automatic water fountain. Then she even packed a stuffed toy that looked just like the cat, planning to take the toy instead. The cat was really upset. But while playing with the toy, the owner worried about leaving her cat all alone. So she asked her mom to take care of it. To her surprise, her mom loved the cat right away. She even slept with it every night, took it out for walks, played games together, and even held the cat while eating. The cat loved grandma, too, sharing its favorite toys and always staying close to her. When the owner came back with gifts, she realized the cat could not leave Grandma anymore. After grandma left, the cat fell into sadness. So, the owner brought out the gift, but the cat was not impressed at all because the gift was nothing but"
FGPrx-fkoqM,This cat loves these water drinking products,1565195,51,20250829,"This cat hates drinking water, but the owner found a genius way to make it drink. Look, whenever the owner tries to give it water, it always refuses. But one day, he caught it secretly drinking from the toilet. That made the owner really mad. So, for the cat's health, he got a big plastic bottle and shaped it like a toilet bowl, then let the cat drink from it. Surprisingly, the cat loved it. It would not stop drinking and even blocked other cats from coming close. But after drinking too much, its chubby body got stuck in the bottle. The owner was speechless, so he bought a mini toilet just for the cat. And the cat was so happy. It started drinking water more often. But the more the owner watched, the more disgusted he felt. So he bought a real pet water fountain that looked like a toilet. It could run water automatically and even had a filter. Unexpectedly, the cat totally fell for it. And now it happily drinks water every single day."
AwZU1Pbey9o,The owner prank his mama cat with fake kitten,3830472,57,20250828,"This owner tried to prank a cat mom with a fake kitten just to see how she would react. Look, this was her first time being a mom, but her behavior was really strange. Sometimes she gently licked her kittens. Then the next second she kicked them away. The owner was so confused. He thought maybe she didn't know how to be a good mom, so he came up with an idea. First, he used some snacks to lure her away. Then, he quickly took one of the kittens. He made a fake kitten out of cat fur. The cat mom didn't even notice one was missing. The owner gave her the fake kitten, telling her it was her baby. At first, she looked confused, but when she smelled the familiar scent, she hugged it tight like it was her own. The owner was speechless. He tried again. This time, he used fur from another cat and made the fake kitten look even more real. Surprisingly, she still hugged it like it was her baby. The owner was completely shocked, so he used a plush toy to show her what happens when she hits her kittens. After that, the cat mom finally learned to be gentle with her babies. So you think she is a good"
TOKACNTRxrw,The owner made cat fur plushies for his cats,1226984,56,20250828,"This is why you should collect cat hair. Look, this owner noticed his cats love watching Tom and Jerry. They line up every day just to watch their favorite cartoon, but they forgot to invite the youngest kitten. When the owner asked where the little one was, they all stayed silent, so he started searching and found the kitten stuck inside a glassroom. It also wanted to watch cartoons. The owner felt so bad to make it up to the kitten. He bought a small computer just for it. Then he decided to make a Jerry doll from cat hair. First, he collected fur from the other cats and used felting to shape Jerry's head and ears. But halfway through, he ran out of fur. So, he tried to pull some from the cats, but they refused. They were all afraid of going bald. So, he opened up a fur ball he had collected and used that instead. Finally, he painted it, and a cute little Jerry was ready. The kitten loved it. When the other cats saw it, they wanted one, too. So, the owner made another Jerry flying a plane and gave it to them. Would you want a cat hair product like [Music]"
H3sjnbFc0NU,The owner bought a mini tiny bed for his cat,8347310,56,20250827,"This owner bought a mini bed for her cat. Look, this cat had always slept with its owner since it was little. But after the owner got married, the cat no longer had a place to sleep. So, she decided to buy it a bed. But she got the wrong size and came home with the tiny mini bed. The cat was really upset because it could not fit at all. Only half of its body could lie on it. Then, after checking the size of the mini bed, the cat squeezed itself in. This made the owner laugh a lot, so she quickly bought a bigger bed. She laid out a mattress, then added some decorations. Surprisingly, the cat loved it. It stayed on the bed without leaving, just like a real little baby. Seeing this, the owner decided to make a cozy home for the cat. She bought another small bed, added a blanket and a pillow, placed a little sofa next to the bed, then spread a fluffy carpet. Just like that, the cat had its own warm little room, and when the owner set up a snack cabinet, the cat loved the room even more. Would you make a cozy space like this for your"
WFrPfgrtsYo,This cat uses sign language to communicate with its owner who can’t hear,2561708,49,20250827,"This cat had no idea its owner can't hear until it learned sign language. Look, when this cat was first adopted, it didn't know its owner couldn't hear or speak, so it would often meow at its owner, but the owner never responded. This confused the cat a lot until one day it saw the owner using sign language. That's when the cat realized its owner couldn't hear. From that day on, everything changed. It started observing the owner's actions and learned sign language. When it wants a snack, it grabs the owner's hand and makes an eating gesture. When it wants to play, it stands up and waves to get the owner's attention. Gradually, it stopped meowing and started using its body to express itself. It even learned to understand sign language. For example, when the owner makes the house gesture, it knows it's time to go back to its bed. But this smart and adorable cat only got one"
gsdXWFYkjyI,These cats loves to hide from the owner but,749100,52,20250826,"This owner can never find her black cat. Look, cats love hiding in the dark, so it is almost impossible to spot them. One time she was taking out the trash and found a cat hiding in the garbage bin. Another time she wanted to cook and saw a cat sitting inside the pot. This drove the girl crazy. She spends every day searching for her cat. Sometimes she thinks she found it, but it turns out to be just a toy. The real cat is hiding inside a bag. This leaves the girl speechless. She is scared she might step on the cat by accident, so she came up with an idea. She put glow-in-the-dark stickers on her cat. At night, the glowing stickers looked creepy, but at least she could finally spot her cat in the dark. But what about during the day? The clever girl had another trick. She dressed her cats in bright, colorful clothes, so she could notice them right away. But not long after, she lost her cats again."
T2YRYnOVZMc,The owner found out the secret of his cats,2777038,53,20250825,"This owner just found out the secret life of his cats. Look, he noticed his cats were always tired in the daytime. Some even had dark circles under their eyes. But at night, he could never find where they went. This made him super suspicious until one night, he saw strange lights coming from a room. He opened the door and found his cats throwing a secret dance party, like they had their own hidden club. At first, the owner did not care much, but the next day, his cats disappeared again. He finally checked a big box and found them partying inside. They were even watching videos of female cats dancing. The owner was speechless. So to fix their crazy schedule, he sealed the box and banned them from watching dance videos. Then every morning, he woke them up early and gave them a bath to stop them from sleeping during the day. At night, he forced them onto the bed so they would fall asleep. Since the owner stayed up late watching dance videos himself, cats went right back to their night"
5AK7BdclM-A,The owner prank his cat with fake cat poop,3825462,58,20250825,"This owner tried to prank his cat with fake poop, but things end up wrong. Look, he bought some iron powder, shaped it like cat poop, and buried it in the litter box. When the cat went to use the bathroom, he pulled out a magnet, and the fake poop flew away. The cat was completely shocked. It really thought its poop could fly, so it started chasing it everywhere. After that, every time it went to the bathroom. It guarded the litter box so the poop would not fly away. The owner thought this was hilarious, so he came up with another idea. He got a brand new litter box, crushed up some bread inside, added black cookie crumbs, and shaped them into fake poop. Then he sat in front of the cats, pretending to eat their poop. The cats were stunned. They thought their owner had lost his mind. They even tried to sneak away, but then the owner fed the fake poop to another cat, which left the first cat even more confused. So, the next time it used the bathroom, it immediately took a bite of its own poop. The owner was terrified. He rushed to brush the cat's teeth and swore never to pull this prank"
rGJkd-L-LKo,These cats love the giant products,6174574,41,20250824,"This owner bought a bunch of giant products for his cats. Look, since more kittens came into the house, the old cat bed became too small, so he bought a giant cat bed. When the kittens went inside, it still looked super spacious. Then the owner climbed in, too, so he could stay with his cats all day and night. When the weather got hotter, he wanted the cats to stay cool, so he bought a giant cooling house. This time, he jumped right in again, enjoying the cool air with them. From then on, he became obsessed with giant products. He got them a giant food bowl. When the kitten stood on it, it looked like standing on top of a mountain. He even bought them a giant litter box. The cats loved it so much. Before the owner even finished pouring the litter, one kitten couldn't wait and used it right"
O-T9oRxfhIY,The owner teaches his cats how to use feeding machine but end up wrong,695338,58,20250823,"This owner tricked his cats into using a feeding machine, but the result was totally unexpected. Look, when he first brought home the feeder, he waved his hand in front of it, making the cats believe that was how to get food. Soon, the first cat gave it a try, and food really came out. Then, the second cat tried, and it worked for him, too. The third cat got really excited, but when it reached out its paw, the feeder suddenly stopped working, it kept trying different ways, but no food came out. The cat got so frustrated. What it didn't know was that the owner was secretly controlling the feeder with his phone and the cat was almost about to cry. The owner finally let it win some food, but nobody expected what happened next. The cat completely misunderstood the trick. When it met a cute female cat, it waved its paw at her, thinking that was how to make friends. Later, when the owner teached how to use the water dispenser, the cat ignored him and waved its paw at the dispenser instead. The owner was about to laugh at it, but the next second, the dispenser actually gave in to its cuteness."
viiFNcQexcw,This owner regrets bought lighting shoes for his cats,1292842,57,20250822,"This is why you should never put morning running shoes on your cats. Look, this guy has a bunch of cats. One night, he got up to use the bathroom. It was too dark and he accidentally stepped on a cat. The cats got really mad and they started ignoring him to win back their hearts. He bought glowing shoes for all of them, but he would not step on them at night. But when night came, the cats looked terrifying. He thought maybe the color was wrong, so he switched to red, but that made them even scarier. One cat even got scared by its own friend. That night, the cat was so frightened it could not sleep. The next morning, it even had dark circles under its eyes to make it feel better. The owner made a pair of slippers out of cat fur, but this made the other cats jealous. They demanded their own pair, too. So, the owner made tiny slippers for every cat. Now, all the cats were happy again. To fix the stepping problem for good, he bought a voice activated light. He bought the wrong size. He did not realize how bad this was until that night when he started snoring."
D6DD6k-qh7c,Genius way to feed kittens without mama cat,1908971,56,20250822,"This owner has a genius way to feed his kittens milk. Look, since the mother cat got sick, the kittens had no milk to drink. So, the owner tried to feed them with a bottle, but the kittens refused to drink from it. So, he poured milk into a bowl instead. But the kittens always made a mess. Milk all over their faces, almost falling right into the bowl to help them drink safely. The clever owner came up with an idea. He carried the kitten in his mouth, making it think he was the mother cat. Then, he hid the bottle under his clothes and let the kitten drink from there. Surprisingly, the kitten really started drinking. Soon, they even lined up for their turn. So, the owner prepared more bottles and let the kittens drink from his body. This way, he solved the problem of feeding them, but had no idea how serious it would get. The kittens now believed he was their mom. Every time they saw him, they climbed onto him, begging for milk. They even started sucking on his fingers and his nose, too. And when he fell asleep, the kittens would sneak onto his chest, still looking for"
TYLstbtsGmY,This cat accepted the capybara friend,4810534,58,20250821,"This owner brought home a capiara for the cats, but things end up wrong. Look, the gray cat looked curious. It had no idea what this animal was. The dog tried to act calm, pretending to be friendly. When it was the ginger cat's turn, it got so scared it hid in a basket. As soon as the Capy Barra came closer, the cat trying to scare it away. But the Capy Barra was not afraid, it just wanted to be friends with everyone. Soon, it became close with the other cats, but the ginger cat stayed on guard. Every time the capiara got near, it would launch an attack. The owner started to worry until he noticed something strange. The cat actually looked a lot like the capiara. They had the same color and both could balance a bottle on their heads. So, the owner told the cat the capiara was its own kind. From that moment, the cat finally accepted the capiara. They even became best friends. But not long after, the owner made a shocking discovery. All the pets wanted to eat the capiara's poop. Turns out Capidara poop is full of nutrients and that drove the other pets"
